{
  "$schema": "http://json-schema.org/draft-03/schema",
  "required": false,
  "type": "array",
  "items": {
    "required": false,
    "type": "object",
    "properties": {
      "comment_id": {
        "required": false,
        "type": "integer"
      },
      "creation_date": {
        "required": false,
        "type": "integer"
      },
      "down_vote_count": {
        "required": false,
        "type": "integer"
      },
      "owner": {
        "required": false,
        "type": "object",
        "properties": {
          "accept_rate": {
            "required": false,
            "type": "integer"
          },
          "badge_counts": {
            "required": false,
            "type": "object",
            "properties": {
              "bronze": {
                "required": false,
                "type": "integer"
              },
              "gold": {
                "required": false,
                "type": "integer"
              },
              "silver": {
                "required": false,
                "type": "integer"
              }
            }
          },
          "display_name": {
            "required": false,
            "type": "string"
          },
          "link": {
            "required": false,
            "type": "string"
          },
          "profile_image": {
            "required": false,
            "type": "string"
          },
          "reputation": {
            "required": false,
            "type": "integer"
          },
          "user_id": {
            "required": false,
            "type": "integer"
          },
          "user_type": {
            "required": false,
            "type": "string"
          }
        }
      },
      "post_id": {
        "required": false,
        "type": "integer"
      },
      "question_id": {
        "required": false,
        "type": "integer"
      },
      "revision_guid": {
        "required": false,
        "type": "string"
      },
      "timeline_type": {
        "required": false,
        "type": "string"
      },
      "up_vote_count": {
        "required": false,
        "type": "integer"
      },
      "user": {
        "required": false,
        "type": "object",
        "properties": {
          "accept_rate": {
            "required": false,
            "type": "integer"
          },
          "badge_counts": {
            "required": false,
            "type": "object",
            "properties": {
              "bronze": {
                "required": false,
                "type": "integer"
              },
              "gold": {
                "required": false,
                "type": "integer"
              },
              "silver": {
                "required": false,
                "type": "integer"
              }
            }
          },
          "display_name": {
            "required": false,
            "type": "string"
          },
          "link": {
            "required": false,
            "type": "string"
          },
          "profile_image": {
            "required": false,
            "type": "string"
          },
          "reputation": {
            "required": false,
            "type": "integer"
          },
          "user_id": {
            "required": false,
            "type": "integer"
          },
          "user_type": {
            "required": false,
            "type": "string"
          }
        }
      }
    }
  }
}